title,mlai
The Road Ahead: Artificial Intelligence will assist in regulatory compliance,1
Can Robots Teach Us How to Be Human?,1
Vehicle DC Voltage Converter Step down 24V to 12V 40A Car Inverter,0
Which Is The Best Tablet For Kids?,0
Top 10 Strongest Dog Breeds in the World,0
Minecraft Pocket Edition Maps Revealed,0
"We really need to take accountability, Microsoft CEO on the Tay chatbot",1
A Decade after DARPA: Our View on the State of the Art in Self-Driving Cars,1
"CES, Elon Musk, Robots, Alexa, Giant TVs, Drone Cars and the coming wave of AR and VR glassesThe Big Tech Show",1
f2fs versus ext4: our take on the ongoing battle,0
7 Facts About Recruiting Software Everyone Should Know,1
Wonder ZooAnimal rescue MOD Apk + Data [Unlimited Money] 2.0.5d Android Download by Gameloft,0
4 REASONS TO INVEST IN DISCOVERYS SUCCESS,1
Work Futures DailyMassacre of the Dilberts,1
Build Android CI with Bitbucket Pipeline and HockeyApp Part 1,0
Bug Bounty Hunting Tips #2 Target their mobile apps (Android Edition),0
DOES NLP HAVE WHAT IT TAKES TO FIX VOICE & TEXT RECOGNITION?,1
Stephen Hawking Delivers Keynote at Web Summit Opening Night,1
Which God should your iPhone believe in?,1
8 Tips and Tricks to make Android Device Faster,0
Xmas Gift WishSmart watches,0
"Log.v(ThreeTips, #16)",0
Important Considerations while Want to Find The Cheap Smartphones,0
How we built an Android / iOS watch app in one day,0
uAvionix Corp. Had Successful DroneAware Test Ride & Demonstration,1
FiLMiC Plus Apk [Full Paid] 5.5.6 b98 Android Download by FiLMiC Inc.,0
We get on like a house on fire,1
"Sports 7/5 WON tipico, sport wetten, wettschein, betting sports, sports betting, sport betting",0
Drones Being Tested For Search & Rescue Purposes In South Wales,1
Tuning your SQLite with SQLDelight & SQLBrite: Part 1,0
Train TJBot to Analyze Emotion in Node-RED,1
Electroneum Re-Launch Today Read Through,0
Everything You Need To Know About Android PRedbytes Software,0
AI enabled travel is here: 5 ways travel just got easier,1
